{
  "formatVersion": 1,
  "languageId": "clike",
  "keywords": [
    "alignas",
    "alignof",
    "and",
    "and_eq",
    "asm",
    "auto",
    "bitand",
    "bitor",
    "bool",
    "break",
    "case",
    "catch",
    "char",
    "char16_t",
    "char32_t",
    "class",
    "co_await",
    "co_return",
    "co_yield",
    "compl",
    "concept",
    "const",
    "const_cast",
    "consteval",
    "constexpr",
    "constinit",
    "continue",
    "decltype",
    "default",
    "delete",
    "do",
    "double",
    "dynamic_cast",
    "else",
    "enum",
    "explicit",
    "export",
    "extern",
    "final",
    "float",
    "for",
    "friend",
    "goto",
    "if",
    "inline",
    "int",
    "long",
    "mutable",
    "namespace",
    "new",
    "noexcept",
    "not",
    "not_eq",
    "operator",
    "or",
    "or_eq",
    "override",
    "private",
    "protected",
    "public",
    "register",
    "reinterpret_cast",
    "requires",
    "restrict",
    "return",
    "short",
    "signed",
    "sizeof",
    "static",
    "static_assert",
    "static_cast",
    "struct",
    "switch",
    "template",
    "this",
    "thread_local",
    "throw",
    "try",
    "typedef",
    "typeid",
    "typename",
    "union",
    "unsigned",
    "using",
    "virtual",
    "void",
    "volatile",
    "wchar_t",
    "while",
    "xor",
    "xor_eq"
  ],
  "literals": [
    "false",
    "null",
    "nullptr",
    "true"
  ],
  "types": [
    "bool",
    "char",
    "double",
    "float",
    "int",
    "long",
    "short",
    "size_t",
    "unsigned",
    "void"
  ],
  "builtins": [],
  "modules": [],
  "notes": [
    "Language-specific lexicon for keyword/literal stopword filtering."
  ]
}
