{
  "formatVersion": 1,
  "languageId": "javascript",
  "keywords": [
    "as",
    "async",
    "await",
    "break",
    "case",
    "catch",
    "class",
    "const",
    "continue",
    "debugger",
    "default",
    "delete",
    "do",
    "else",
    "enum",
    "export",
    "extends",
    "finally",
    "for",
    "from",
    "function",
    "if",
    "implements",
    "import",
    "in",
    "instanceof",
    "interface",
    "let",
    "new",
    "of",
    "package",
    "private",
    "protected",
    "public",
    "return",
    "static",
    "super",
    "switch",
    "this",
    "throw",
    "try",
    "typeof",
    "var",
    "void",
    "while",
    "with",
    "yield"
  ],
  "literals": [
    "false",
    "null",
    "true",
    "undefined"
  ],
  "types": [],
  "builtins": [
    "array",
    "console",
    "date",
    "error",
    "json",
    "map",
    "math",
    "promise",
    "set"
  ],
  "modules": [
    "fs",
    "path"
  ],
  "notes": [
    "Expanded JavaScript keyword/literal coverage for lexicon stopword filtering."
  ]
}
