{
  "formatVersion": 1,
  "languageId": "csharp",
  "keywords": [
    "abstract",
    "add",
    "alias",
    "ascending",
    "async",
    "await",
    "base",
    "bool",
    "break",
    "by",
    "byte",
    "case",
    "catch",
    "char",
    "checked",
    "class",
    "const",
    "continue",
    "decimal",
    "default",
    "delegate",
    "descending",
    "do",
    "double",
    "dynamic",
    "else",
    "enum",
    "equals",
    "event",
    "explicit",
    "extern",
    "finally",
    "fixed",
    "float",
    "for",
    "foreach",
    "from",
    "get",
    "global",
    "goto",
    "group",
    "if",
    "implicit",
    "in",
    "init",
    "int",
    "interface",
    "internal",
    "into",
    "is",
    "join",
    "let",
    "lock",
    "long",
    "nameof",
    "namespace",
    "new",
    "object",
    "operator",
    "orderby",
    "out",
    "override",
    "params",
    "partial",
    "private",
    "protected",
    "public",
    "readonly",
    "record",
    "ref",
    "remove",
    "return",
    "sbyte",
    "sealed",
    "select",
    "set",
    "short",
    "sizeof",
    "stackalloc",
    "static",
    "string",
    "struct",
    "switch",
    "this",
    "throw",
    "try",
    "typeof",
    "uint",
    "ulong",
    "unchecked",
    "unsafe",
    "ushort",
    "using",
    "value",
    "var",
    "virtual",
    "void",
    "volatile",
    "when",
    "where",
    "while",
    "with",
    "yield"
  ],
  "literals": [
    "false",
    "null",
    "true"
  ],
  "types": [
    "bool",
    "byte",
    "char",
    "decimal",
    "double",
    "dynamic",
    "float",
    "int",
    "long",
    "object",
    "short",
    "string",
    "uint",
    "ulong",
    "ushort",
    "void"
  ],
  "builtins": [],
  "modules": [],
  "notes": [
    "Language-specific lexicon for keyword/literal stopword filtering."
  ]
}
