{
  "formatVersion": 1,
  "languageId": "dart",
  "keywords": [
    "abstract",
    "as",
    "assert",
    "async",
    "await",
    "base",
    "break",
    "case",
    "catch",
    "class",
    "const",
    "continue",
    "covariant",
    "default",
    "deferred",
    "do",
    "dynamic",
    "else",
    "enum",
    "export",
    "extends",
    "extension",
    "external",
    "factory",
    "final",
    "finally",
    "for",
    "function",
    "get",
    "hide",
    "if",
    "implements",
    "import",
    "in",
    "interface",
    "is",
    "late",
    "library",
    "mixin",
    "new",
    "on",
    "operator",
    "part",
    "required",
    "rethrow",
    "return",
    "sealed",
    "set",
    "show",
    "static",
    "super",
    "switch",
    "sync",
    "this",
    "throw",
    "try",
    "typedef",
    "var",
    "void",
    "when",
    "while",
    "with",
    "yield"
  ],
  "literals": [
    "false",
    "null",
    "true"
  ],
  "types": [
    "bool",
    "double",
    "dynamic",
    "int",
    "num",
    "object",
    "string",
    "void"
  ],
  "builtins": [],
  "modules": [],
  "notes": [
    "Language-specific lexicon for keyword/literal stopword filtering."
  ]
}
