{
  "formatVersion": 1,
  "languageId": "swift",
  "keywords": [
    "actor",
    "any",
    "as",
    "associatedtype",
    "async",
    "await",
    "borrowing",
    "break",
    "case",
    "catch",
    "class",
    "continue",
    "convenience",
    "default",
    "defer",
    "deinit",
    "distributed",
    "do",
    "dynamic",
    "else",
    "enum",
    "extension",
    "fallthrough",
    "fileprivate",
    "final",
    "for",
    "func",
    "guard",
    "higherthan",
    "if",
    "import",
    "in",
    "indirect",
    "infix",
    "init",
    "inout",
    "internal",
    "isolated",
    "lazy",
    "let",
    "lowerthan",
    "macro",
    "mutating",
    "nonisolated",
    "nonmutating",
    "open",
    "operator",
    "optional",
    "override",
    "package",
    "postfix",
    "precedencegroup",
    "prefix",
    "private",
    "protocol",
    "public",
    "repeat",
    "required",
    "rethrows",
    "return",
    "self",
    "sending",
    "some",
    "static",
    "struct",
    "subscript",
    "super",
    "switch",
    "throw",
    "throws",
    "try",
    "typealias",
    "unowned",
    "var",
    "weak",
    "where",
    "while"
  ],
  "literals": [
    "false",
    "nil",
    "true"
  ],
  "types": [
    "any",
    "bool",
    "double",
    "float",
    "int",
    "optional",
    "string",
    "void"
  ],
  "builtins": [],
  "modules": [],
  "notes": [
    "Language-specific lexicon for keyword/literal stopword filtering."
  ]
}
