{
  "formatVersion": 1,
  "languageId": "starlark",
  "keywords": [
    "and",
    "as",
    "assert",
    "break",
    "class",
    "continue",
    "def",
    "del",
    "elif",
    "else",
    "except",
    "finally",
    "for",
    "from",
    "global",
    "if",
    "import",
    "in",
    "is",
    "lambda",
    "load",
    "nonlocal",
    "not",
    "or",
    "pass",
    "raise",
    "return",
    "try",
    "while",
    "with",
    "yield"
  ],
  "literals": [
    "false",
    "none",
    "true"
  ],
  "types": [],
  "builtins": [],
  "modules": [],
  "notes": [
    "Language-specific lexicon for keyword/literal stopword filtering."
  ]
}
