{
  "formatVersion": 1,
  "languageId": "sql",
  "keywords": [
    "abort",
    "action",
    "add",
    "after",
    "all",
    "alter",
    "analyse",
    "analyze",
    "and",
    "any",
    "array",
    "as",
    "asc",
    "attach",
    "auto_increment",
    "autoincrement",
    "before",
    "begin",
    "between",
    "bigint",
    "bigserial",
    "binary",
    "bit",
    "blob",
    "boolean",
    "by",
    "bytea",
    "cascade",
    "case",
    "cast",
    "character",
    "charset",
    "check",
    "collate",
    "column",
    "columns",
    "comment",
    "commit",
    "concurrently",
    "conflict",
    "constraint",
    "create",
    "cross",
    "current",
    "current_catalog",
    "current_date",
    "current_schema",
    "current_time",
    "current_timestamp",
    "current_user",
    "cursor",
    "cycle",
    "database",
    "deallocate",
    "declare",
    "default",
    "deferred",
    "delete",
    "desc",
    "detach",
    "distinct",
    "do",
    "drop",
    "each",
    "else",
    "elseif",
    "elsif",
    "end",
    "engine",
    "enum",
    "escape",
    "except",
    "exclusive",
    "exists",
    "explain",
    "extension",
    "fail",
    "fetch",
    "for",
    "force",
    "foreign",
    "from",
    "full",
    "fulltext",
    "function",
    "generated",
    "glob",
    "grant",
    "group",
    "having",
    "high_priority",
    "identity",
    "if",
    "ignore",
    "ilike",
    "immediate",
    "immutable",
    "in",
    "index",
    "indexed",
    "inherits",
    "initially",
    "inner",
    "insert",
    "instead",
    "intersect",
    "into",
    "is",
    "isnull",
    "join",
    "key",
    "keys",
    "language",
    "left",
    "like",
    "limit",
    "listen",
    "local",
    "lock",
    "loop",
    "low_priority",
    "match",
    "materialized",
    "modify",
    "not",
    "notify",
    "notnull",
    "numeric",
    "offset",
    "on",
    "or",
    "order",
    "outer",
    "over",
    "owner",
    "partition",
    "plan",
    "pragma",
    "prepare",
    "prepared",
    "primary",
    "procedure",
    "query",
    "raise",
    "recursive",
    "references",
    "reindex",
    "release",
    "rename",
    "repeat",
    "replace",
    "restrict",
    "return",
    "returning",
    "returns",
    "revoke",
    "right",
    "role",
    "rollback",
    "row",
    "rowid",
    "rows",
    "savepoint",
    "schema",
    "security",
    "select",
    "serial",
    "session_user",
    "set",
    "setof",
    "share",
    "signal",
    "similar",
    "spatial",
    "sql_calc_found_rows",
    "sql_no_cache",
    "stable",
    "straight_join",
    "table",
    "temp",
    "temporary",
    "then",
    "timestamp",
    "transaction",
    "trigger",
    "union",
    "unique",
    "unlogged",
    "unsigned",
    "until",
    "update",
    "uuid",
    "vacuum",
    "values",
    "varying",
    "verbose",
    "view",
    "virtual",
    "volatile",
    "when",
    "where",
    "while",
    "with",
    "without",
    "zerofill"
  ],
  "literals": [
    "false",
    "nan",
    "null",
    "true"
  ],
  "types": [
    "bigint",
    "blob",
    "boolean",
    "char",
    "date",
    "datetime",
    "decimal",
    "double",
    "float",
    "int",
    "integer",
    "json",
    "numeric",
    "real",
    "text",
    "time",
    "timestamp",
    "uuid",
    "varchar"
  ],
  "builtins": [],
  "modules": [],
  "notes": [
    "Language-specific lexicon for keyword/literal stopword filtering."
  ]
}
